{
  "generated_at": "2026-07-14T23:24:44.815Z",
  "next_recommended_pack": "pack.004",
  "blocked_packs": [],
  "human_review_packs": [],
  "packs": [
    {
      "pack_id": "pack.001",
      "pack_number": 1,
      "title": {
        "en": "Everyday Property, Construction and Finance Fundamentals",
        "tr": "Günlük Gayrimenkul, İnşaat ve Finans Temelleri"
      },
      "status": "complete",
      "target_entry_count": 100,
      "reviewed_entry_count": 100,
      "draft_entry_count": 0,
      "duplicate_count": 0,
      "missing_source_count": 0,
      "broken_reference_count": 0,
      "handbook_coverage": 6,
      "calculator_coverage": 6,
      "completion_percentage": 100,
      "requires_human_review": false
    },
    {
      "pack_id": "pack.002",
      "pack_number": 2,
      "title": {
        "en": "Residential Property Fundamentals",
        "tr": "Konut Gayrimenkulü Temelleri"
      },
      "status": "complete",
      "target_entry_count": 100,
      "reviewed_entry_count": 100,
      "draft_entry_count": 0,
      "duplicate_count": 0,
      "missing_source_count": 0,
      "broken_reference_count": 0,
      "handbook_coverage": 30,
      "calculator_coverage": 4,
      "completion_percentage": 100,
      "requires_human_review": false
    },
    {
      "pack_id": "pack.003",
      "pack_number": 3,
      "title": {
        "en": "Property Investor Fundamentals",
        "tr": "Gayrimenkul Yatırımcılığı Temelleri"
      },
      "status": "complete",
      "target_entry_count": 100,
      "reviewed_entry_count": 100,
      "draft_entry_count": 0,
      "duplicate_count": 0,
      "missing_source_count": 0,
      "broken_reference_count": 0,
      "handbook_coverage": 84,
      "calculator_coverage": 14,
      "completion_percentage": 100,
      "requires_human_review": false
    },
    {
      "pack_id": "pack.004",
      "pack_number": 4,
      "title": {
        "en": "Foundation Pack 004",
        "tr": "Temeller Paketi 004"
      },
      "status": "planned",
      "target_entry_count": 100,
      "reviewed_entry_count": 0,
      "draft_entry_count": 0,
      "duplicate_count": 0,
      "missing_source_count": 0,
      "broken_reference_count": 0,
      "handbook_coverage": 0,
      "calculator_coverage": 0,
      "completion_percentage": 0,
      "requires_human_review": false
    },
    {
      "pack_id": "pack.005",
      "pack_number": 5,
      "title": {
        "en": "Foundation Pack 005",
        "tr": "Temeller Paketi 005"
      },
      "status": "planned",
      "target_entry_count": 100,
      "reviewed_entry_count": 0,
      "draft_entry_count": 0,
      "duplicate_count": 0,
      "missing_source_count": 0,
      "broken_reference_count": 0,
      "handbook_coverage": 0,
      "calculator_coverage": 0,
      "completion_percentage": 0,
      "requires_human_review": false
    },
    {
      "pack_id": "pack.006",
      "pack_number": 6,
      "title": {
        "en": "Foundation Pack 006",
        "tr": "Temeller Paketi 006"
      },
      "status": "planned",
      "target_entry_count": 100,
      "reviewed_entry_count": 0,
      "draft_entry_count": 0,
      "duplicate_count": 0,
      "missing_source_count": 0,
      "broken_reference_count": 0,
      "handbook_coverage": 0,
      "calculator_coverage": 0,
      "completion_percentage": 0,
      "requires_human_review": false
    },
    {
      "pack_id": "pack.007",
      "pack_number": 7,
      "title": {
        "en": "Foundation Pack 007",
        "tr": "Temeller Paketi 007"
      },
      "status": "planned",
      "target_entry_count": 100,
      "reviewed_entry_count": 0,
      "draft_entry_count": 0,
      "duplicate_count": 0,
      "missing_source_count": 0,
      "broken_reference_count": 0,
      "handbook_coverage": 0,
      "calculator_coverage": 0,
      "completion_percentage": 0,
      "requires_human_review": false
    },
    {
      "pack_id": "pack.008",
      "pack_number": 8,
      "title": {
        "en": "Foundation Pack 008",
        "tr": "Temeller Paketi 008"
      },
      "status": "planned",
      "target_entry_count": 100,
      "reviewed_entry_count": 0,
      "draft_entry_count": 0,
      "duplicate_count": 0,
      "missing_source_count": 0,
      "broken_reference_count": 0,
      "handbook_coverage": 0,
      "calculator_coverage": 0,
      "completion_percentage": 0,
      "requires_human_review": false
    },
    {
      "pack_id": "pack.009",
      "pack_number": 9,
      "title": {
        "en": "Foundation Pack 009",
        "tr": "Temeller Paketi 009"
      },
      "status": "planned",
      "target_entry_count": 100,
      "reviewed_entry_count": 0,
      "draft_entry_count": 0,
      "duplicate_count": 0,
      "missing_source_count": 0,
      "broken_reference_count": 0,
      "handbook_coverage": 0,
      "calculator_coverage": 0,
      "completion_percentage": 0,
      "requires_human_review": false
    },
    {
      "pack_id": "pack.010",
      "pack_number": 10,
      "title": {
        "en": "Foundation Pack 010",
        "tr": "Temeller Paketi 010"
      },
      "status": "planned",
      "target_entry_count": 100,
      "reviewed_entry_count": 0,
      "draft_entry_count": 0,
      "duplicate_count": 0,
      "missing_source_count": 0,
      "broken_reference_count": 0,
      "handbook_coverage": 0,
      "calculator_coverage": 0,
      "completion_percentage": 0,
      "requires_human_review": false
    },
    {
      "pack_id": "pack.011",
      "pack_number": 11,
      "title": {
        "en": "Residential Property Pack 011",
        "tr": "Konut Gayrimenkulü Paketi 011"
      },
      "status": "planned",
      "target_entry_count": 100,
      "reviewed_entry_count": 0,
      "draft_entry_count": 0,
      "duplicate_count": 0,
      "missing_source_count": 0,
      "broken_reference_count": 0,
      "handbook_coverage": 0,
      "calculator_coverage": 0,
      "completion_percentage": 0,
      "requires_human_review": false
    },
    {
      "pack_id": "pack.012",
      "pack_number": 12,
      "title": {
        "en": "Residential Property Pack 012",
        "tr": "Konut Gayrimenkulü Paketi 012"
      },
      "status": "planned",
      "target_entry_count": 100,
      "reviewed_entry_count": 0,
      "draft_entry_count": 0,
      "duplicate_count": 0,
      "missing_source_count": 0,
      "broken_reference_count": 0,
      "handbook_coverage": 0,
      "calculator_coverage": 0,
      "completion_percentage": 0,
      "requires_human_review": false
    },
    {
      "pack_id": "pack.013",
      "pack_number": 13,
      "title": {
        "en": "Residential Property Pack 013",
        "tr": "Konut Gayrimenkulü Paketi 013"
      },
      "status": "planned",
      "target_entry_count": 100,
      "reviewed_entry_count": 0,
      "draft_entry_count": 0,
      "duplicate_count": 0,
      "missing_source_count": 0,
      "broken_reference_count": 0,
      "handbook_coverage": 0,
      "calculator_coverage": 0,
      "completion_percentage": 0,
      "requires_human_review": false
    },
    {
      "pack_id": "pack.014",
      "pack_number": 14,
      "title": {
        "en": "Residential Property Pack 014",
        "tr": "Konut Gayrimenkulü Paketi 014"
      },
      "status": "planned",
      "target_entry_count": 100,
      "reviewed_entry_count": 0,
      "draft_entry_count": 0,
      "duplicate_count": 0,
      "missing_source_count": 0,
      "broken_reference_count": 0,
      "handbook_coverage": 0,
      "calculator_coverage": 0,
      "completion_percentage": 0,
      "requires_human_review": false
    },
    {
      "pack_id": "pack.015",
      "pack_number": 15,
      "title": {
        "en": "Residential Property Pack 015",
        "tr": "Konut Gayrimenkulü Paketi 015"
      },
      "status": "planned",
      "target_entry_count": 100,
      "reviewed_entry_count": 0,
      "draft_entry_count": 0,
      "duplicate_count": 0,
      "missing_source_count": 0,
      "broken_reference_count": 0,
      "handbook_coverage": 0,
      "calculator_coverage": 0,
      "completion_percentage": 0,
      "requires_human_review": false
    },
    {
      "pack_id": "pack.016",
      "pack_number": 16,
      "title": {
        "en": "Residential Property Pack 016",
        "tr": "Konut Gayrimenkulü Paketi 016"
      },
      "status": "planned",
      "target_entry_count": 100,
      "reviewed_entry_count": 0,
      "draft_entry_count": 0,
      "duplicate_count": 0,
      "missing_source_count": 0,
      "broken_reference_count": 0,
      "handbook_coverage": 0,
      "calculator_coverage": 0,
      "completion_percentage": 0,
      "requires_human_review": false
    },
    {
      "pack_id": "pack.017",
      "pack_number": 17,
      "title": {
        "en": "Residential Property Pack 017",
        "tr": "Konut Gayrimenkulü Paketi 017"
      },
      "status": "planned",
      "target_entry_count": 100,
      "reviewed_entry_count": 0,
      "draft_entry_count": 0,
      "duplicate_count": 0,
      "missing_source_count": 0,
      "broken_reference_count": 0,
      "handbook_coverage": 0,
      "calculator_coverage": 0,
      "completion_percentage": 0,
      "requires_human_review": false
    },
    {
      "pack_id": "pack.018",
      "pack_number": 18,
      "title": {
        "en": "Residential Property Pack 018",
        "tr": "Konut Gayrimenkulü Paketi 018"
      },
      "status": "planned",
      "target_entry_count": 100,
      "reviewed_entry_count": 0,
      "draft_entry_count": 0,
      "duplicate_count": 0,
      "missing_source_count": 0,
      "broken_reference_count": 0,
      "handbook_coverage": 0,
      "calculator_coverage": 0,
      "completion_percentage": 0,
      "requires_human_review": false
    },
    {
      "pack_id": "pack.019",
      "pack_number": 19,
      "title": {
        "en": "Residential Property Pack 019",
        "tr": "Konut Gayrimenkulü Paketi 019"
      },
      "status": "planned",
      "target_entry_count": 100,